commit	val_bpb	memory_gb	mfu	tok_per_sec	num_steps	num_params_M	batch_size	final_loss	status	description
c1d383e	0.900148	9.3	70.3	39700	1526	250.3	4	2.658	discard	Logit softcap 15->12 (tighter logit compression) at d20 (hypothesis: softcap=30 was catastrophic +0.040 so tighter compression may strengthen gradient on high-confidence tokens; evidence: f5a9cd9 proved softcap is load-bearing): val_bpb 0.8988->0.9001 WORSE by +0.0013. Final train loss 2.658 vs baseline 2.662. MFU 70.3 similar. Conclusion: softcap=15 is the local optimum — both tighter (12) and looser (30) are worse. Tighter softcap over-constrains logits preventing the model from expressing confident predictions on easy tokens. Rules out: softcap tuning in either direction. The modded-nanogpt default of 15 transfers exactly to our 250M d20 setup.
9b5d651	0.902818	9.3	73.5	40200	1526	250.3	4	2.660	discard	EMBEDDING_LR 0.4->0.8 (double embedding LR) (hypothesis: higher embed LR accelerates embedding feature learning in undertrained regime 0.8 tok/param; evidence: dc70894 conclusion stated reducing LR hurt and 'higher may be appropriate'): val_bpb 0.8988->0.9028 WORSE by +0.004. Final train loss 2.660 matches d20 baseline 2.662. Conclusion: EMBEDDING_LR=0.4 is AT the local optimum — both directions (0.2 via dc70894 and now 0.8) are worse. dc70894's conclusion was misleading projection; 0.4 is tuned. Doubling probably causes embedding instability beyond what muP compensates for (AdamW beta1=0.8 already amplifies rapid updates). Rules out: EMBEDDING_LR tuning in EITHER direction. Future: leave EMBEDDING_LR=0.4 fixed.
5b4910a	0.896775	9.5	71.5	40700	1526	250.3	4	2.658	keep	Learnable logit multiplier: softcap*tanh(m*logits/softcap) with m nn.Parameter init 1.0 trained at scalar_lr*0.01=0.005 via AdamW (hypothesis: fixed softcap=15 is locally tuned per f5a9cd9+c1d383e but a LEARNABLE scalar lets model dynamically adjust effective compression; evidence: f5a9cd9 softcap=30 +0.04 worse and c1d383e softcap=12 +0.001 worse both failed as STATIC hyperparameter changes): val_bpb 0.8988->0.8968 IMPROVEMENT -0.0020. Final train loss 2.658 vs d20 2.662. 1 new scalar param (250.3M total unchanged). MXFP8 lib not loaded so fallback to standard FP8 (small confounder but expected to hurt not help). Conclusion: adapting logit compression dynamically during training helps; first architectural KEEP since depth exp ff77921. Rules out: softcap as static constant — use learnable scalar instead.
0dcc944	0.899263	9.2	73.7	40370	1526	250.3	4	2.653	discard	RoPE base 10000->50000 at d20 partial RoPE with learnable logit multiplier (hypothesis: higher base improves positional coherence because partial RoPE has only 32 rotated dims/head and arxiv 2602.10959 plus YaRN 2310.05209 show base choice affects phase coherence; evidence: no prior RoPE base experiment in results.tsv): val_bpb 0.8968->0.8993 WORSE while final train loss improved 2.658->2.653 and MFU stayed healthy at 73.7. Conclusion: base=10000 is better for 2048-token ClimbMix; base=50000 likely under-rotates local relative positions and hurts validation despite no parameter cost. Rules out conservative 5x RoPE base increase at current d20.
5274596	0.898900	10.2	72.4	39350	1526	250.3	4	2.652	discard	Variance-Adaptive Muon NSR: add float32 variance_buffer and pre-Newton-Schulz normalization g/sqrt(g^2+1000*variance_hat) while preserving existing Muon LR scaling and WD mask (hypothesis: arxiv 2601.14603 VAM improves optimizer sample efficiency without NorMuon dynamic-LR failure; evidence: 240982f only ruled out NorMuon LR normalization, not pre-NSR variance): val_bpb 0.8968->0.8989 WORSE despite final train loss improving 2.658->2.652, peak VRAM rising 9.5->10.2GB, and MFU staying ~72.4. Conclusion: VAM-NSR overfits/over-conditions gradients for this 200M-token regime; better train loss does not transfer to BPB. Rules out alpha=1000 NSR preconditioning in current Muon path.
79ab8b6	0.983718	8.7	73.4	39727	1526	250.3	4	2.782	discard	Replace QK RMSNorm with elementwise tanh(q), tanh(k) after RoPE/key-shift only (hypothesis: bounded Q/K activations might keep attention logits well-conditioned without full DyT residual norm replacement, evidence: d475893 only ruled out full DyT and output logit softcap/logit_mult showed bounded logits are load-bearing): val_bpb 0.8968->0.9837 CATASTROPHIC despite healthy throughput/MFU and full 200M-token completion. Final loss worsened 2.658->2.782. Conclusion: QK RMSNorm is essential, not optional normalization overhead. Elementwise tanh destroys Q/K direction/magnitude geometry and severely harms attention learning even though it bounds logits. Rules out norm-free tanh soft-clipping of Q/K in this architecture.
d748827	0.000000	0.0	43.0	22833	722	250.3	4	4.491	crash	Zero-param shared-logits 2-step MTP auxiliary loss: add CE(logits[:, :-1], targets[:, 1:]) with curriculum weight 0.0->0.3 over warmup, eval NTP unchanged (hypothesis: future-token supervision densifies gradients; evidence: no prior MTP and external MTP wins): TIMEOUT killed at 75min after only 47.4% tokens (step 722/1526, 94.6M/200M processed, ~105M remaining). Aux CE roughly doubled loss computation and collapsed throughput to ~22.8k tok/s / 43% MFU vs baseline ~40.7k tok/s / 71.5% MFU. Conclusion: shared-logits MTP is computationally too expensive under this compile/runtime and cannot finish within protocol; it also makes training loss non-comparable. Rules out naive shared-vocab-logit MTP auxiliary loss. Future MTP would need a much cheaper sampled/low-rank/small-head formulation.
fde4025	0.898101	8.9	72.6	38207	1526	300.6	4	2.643	discard	Add 2^16-bucket hashed bigram embedding (prev_token,current_token hash) before initial RMSNorm, bf16 table + AdamW with embedding LR, +50.3M params (hypothesis: GPT-2 BPE adjacent-token pairs carry lexical signal absent from unigram wte/value_emb; evidence: modded-nanogpt #62/#68 bigram hash wins and no prior hash test): val_bpb 0.8968->0.8981 WORSE by +0.0013 despite final train loss improving 2.658->2.643 and healthy MFU 72.6. Conclusion: hashed bigram features improve training fit but slightly overfit or inject collision noise that does not transfer to ClimbMix BPB at 200M tokens. Extra 50M embedding params are not justified. Rules out naive additive 2^16 bigram hash table before x0 norm; future hash work would need smaller/regularized/gated table.
0c94b26	0.900622	8.9	73.2	38466	1526	250.3	4	2.654	discard	Per-head Muon orthogonalization for Q/K only: reshape each c_q/c_k update from 768x768 into six 128x768 head matrices before Newton-Schulz and second-moment scaling, leaving V/O/MLP unchanged (hypothesis: heads are independent projections and whole-matrix Muon couples unrelated heads; evidence: modded-nanogpt #80 and no prior per-head Muon test): val_bpb 0.8968->0.9006 WORSE by +0.0038. Throughput/MFU stayed healthy (73.2), final train loss 2.654 improved slightly vs best 2.658, but validation degraded. Conclusion: whole-matrix Q/K Muon geometry is beneficial here, likely sharing cross-head update structure that regularizes attention; per-head orthogonalization overfits/decouples heads. Rules out per-head Q/K Muon at 6x128 d20.
580c70a	0.898300	10.3	72.2	38031	1526	327.5	4	2.652	discard	Split shared value_emb into 3 early/mid/late banks selected by layer depth, keeping existing ve_gate and no VE weight decay (hypothesis: gated V injection may need depth-specific token features; evidence: 94d986b only ruled out VE WD and modded-nanogpt #63/#65/#70 found VE layout wins): val_bpb 0.8968->0.8983 WORSE by +0.0015 despite final train loss improving 2.658->2.652 and VRAM still within cap at 10.3GB. Conclusion: extra VE capacity improves training fit but does not transfer; the single shared VE likely acts as useful regularizer/shared token prior across depth. Rules out simple 3-bank early/mid/late VE untying at d20.
fdaab78	0.896678	8.9	74.8	40289	1526	250.3	4	2.652	discard	Layer-11 output backout alpha init 0 adds x_final=x+alpha*h11 before final norm and trains alpha at scalar_lr*0.01 (hypothesis: final head benefits from last pre-MLP-only latent while avoiding c44037e all-prior residual compile/OOM; evidence: plateau after recent non-crash discards plus c44037e only ruled out full all-prior mixing): val_bpb 0.896775->0.896678 noise-level improvement of 0.00010 with final_loss 2.652 and MFU 74.8. Conclusion: below 0.002 hard minimum and adds saved activation complexity so discard; rules out a single zero-init scalar backout from layer 11 as a meaningful bottleneck fix.
f9340ff	0.929815	8.9	70.6	38279	1526	250.3	4	2.716	discard	Clamp SwiGLU MLP activations with gate max 6 and up range [-6,6] before silu(gate)*up (hypothesis: limiting MLP outliers improves validation while preserving smooth SwiGLU; evidence: a6db89c only ruled out ReLU2 replacement and 99930a8 ruled out naive norm disruption): val_bpb 0.896775->0.929815 much worse, final_loss worsened to 2.716 and MFU fell to 70.6. Conclusion: current SwiGLU needs its full activation range for optimization at d20; clamp underfits and slows training. Rules out simple hard clipping of SwiGLU gate/up at 6 for this architecture.
8cfeee9	0.914808	8.9	72.9	39319	1526	250.3	4	2.687	discard	Output embedding mu-centering uses W_centered = lm_head.weight - mean(W, dim=0) for logits while preserving softcap=15 and learned logit_mult (hypothesis: suppress lm_head anisotropy/logit divergence per arxiv:2601.02031; evidence: f5a9cd9/c1d383e/5b4910a show output geometry is load-bearing but no prior centering test): val_bpb 0.896775->0.914808 much worse despite healthy MFU 72.9 and final_loss 2.687. Conclusion: subtracting the output-head mean removes useful unigram/output bias or conflicts with muP lm_head geometry; output interface benefits from learned logit scale but not OEC-style weight centering here. Rules out deterministic lm_head feature-centering with current softcap/logit_mult.
c871895	0.908142	10.6	66.3	39448	1526	220.9	4	2.668	discard	GQA direct KV sharing: n_kv_head 6->3 while keeping n_head=6, head_dim=128, d20, shared value_emb resized with K/V and enable_gqa active (hypothesis: KV sharing regularizes attention/value capacity and tests the frontier GQA default without d44e564 MLA's 384-d latent bottleneck; evidence: plateau plus GQA literature): val_bpb 0.896775->0.908142 much worse, final_loss 2.668 vs best 2.658, params fell 250.3M->220.9M, peak VRAM rose to 10.6GB and MFU dropped to 66.3. Conclusion: direct KV/value_emb sharing removes too much per-head K/V/token-value capacity at 6x128 d20; the bottleneck is not KV redundancy. Rules out n_kv_head=3 GQA at current width/depth and suggests full 6 KV heads are load-bearing.
1b0b87b	0.901010	9.7	69.0	39304	1526	254.6	4	2.656	discard	L3-style token lookup adapter in MLP-only layer 13: 2^15x128 token table hashed by current token id, gate=sigmoid(linear(norm(x))), 128->768 projection, alpha init 0 and learned to 1.17 (hypothesis: small context-gated mid-layer lexical memory avoids fde4025's large pre-x0 bigram overfit while adding sparse token-routed capacity; evidence: arxiv:2601.21461 L3 lookup layers): val_bpb 0.896775->0.901010 worse despite final_loss improving 2.658->2.656, params 250.3M->254.6M, MFU 69.0. Conclusion: the lookup branch learned to activate strongly but improved train fit without validation transfer, so token-routed lexical memory is an overfit/noise path at 200M tokens. Rules out small gated unigram lookup adapters in MLP-only layer 13.
a35b330	0.909287	8.9	75.0	40961	1526	250.3	4	2.655	discard	Progressive residual warmup at d20: residual branch scale ramps by depth so layer l reaches full scale at 0.18*(l+1)/20 of TOKEN_BUDGET, final architecture identical (hypothesis: ProRes would stabilize deep residual learning because d20 helped but d22/residual variants were brittle; evidence: arxiv:2603.05369 plus ff77921/05deeab/c44037e/758f6c3): val_bpb worsened 0.896775->0.909287 despite healthy MFU 75.0 and final_loss 2.655 similar to best 2.658. Conclusion: delaying residual-branch gradients wastes scarce early optimization steps in this already zero-c_proj identity-initialized architecture; the d20 bottleneck is not early deep-branch instability. Rules out ProRes-style time/depth residual warmup at 18% for current d20.
1cf3600	0.898948	9.9	71.3	38678	1526	260.3	4	2.652	discard	Identity-anchored nonlinear query projection: q=c_q(x)+alpha*W_up(GELU(W_down(RMSNorm(x)))) with rank 384 per attention layer, alpha init 0, K/V/O/RoPE/QK RMSNorm unchanged (hypothesis: nonlinear query branch improves attention routing expressivity without removing load-bearing QK geometry; evidence: arxiv:2603.13381 plus local QK tanh/per-head Muon/head-count tests did not isolate nonlinear Q): val_bpb 0.896775->0.898948 worse by +0.0022 despite final_loss 2.652 slightly better than best 2.658; params rose 250.3M->260.3M and MFU fell 75->71.3. Conclusion: extra query expressivity improves train fit but does not transfer at 200M tokens; the bottleneck is not W_Q linearity. Rules out alpha-zero half-width nonlinear Q adapters in current d20.
31f7999	0.901644	9.2	76.3	38554	1526	251.9	4	2.659	discard	NOBLE-style attention c_proj nonlinear low-rank branch: c_proj(y)+W_up(SiLU(W_down(y))) rank 64 in every attention layer with W_down uniform init and W_up zero init so the run starts as exact current best (hypothesis: attention output projection linearity is the d20 plateau bottleneck, evidence: arxiv:2603.06492 reports NOBLE pretraining gains and no prior c_proj nonlinear branch; dedup found only rank384 nonlinear Q 1cf3600): val_bpb worsened 0.896775->0.901644 despite healthy MFU 76.3 and final_loss 2.659 matching best 2.658. Conclusion: adding small nonlinear output-projection capacity improves neither train loss nor validation enough; c_proj linearity is not the bottleneck and extra projection-side nonlinearity likely adds optimization/regularization burden. Rules out rank64 zero-init NOBLE c_proj branches at d20.
3c0ee5f	0.899068	9.2	67.0	38127	1526	250.3	4	2.714	discard	Static depth-dependent residual branch scaling: branch outputs multiplied by scale_l=1.0+0.15*l/(n_layer-1) for both attention and MLP branches, no extra params (hypothesis: later d20 layers under-contribute after d22 saturation; evidence: ff77921 depth keep, 05deeab d22 flat, a35b330 only ruled out progressive time warmup): val_bpb worsened 0.896775->0.899068 and MFU dropped 71.5->67.0 while final_loss 2.714 was worse than best 2.658. Conclusion: stronger late residual branches destabilize/underfit rather than fixing depth balance. The baseline branch scale 1.0 is tuned; d20 saturation is not due to weak late-layer residual contribution. Rules out static +15% depth branch scaling.
578eaef	0.901883	9.3	70.4	39068	1526	250.3	4	2.660	discard	Hourglass FFN in MLP-only layers (12,13,14): replace single wide SwiGLU (hidden=2048, 3*768*2048=4.72M per layer) with K=4 stacked SwiGLU sub-blocks at d_h=512 plus internal RMSnorm and residuals (h_{i+1}=h_i+sub(rms_norm(h_i)), return h_K-h_0), exact param-match 4*3*512*768=4.72M (hypothesis: compositional depth of 4 sequential nonlinearities improves expressivity at fixed param count per arxiv 2602.06471 reporting hourglass beats narrow-wide-narrow <400M; evidence: shape convention paper Feb 2026 + plateau-busting context at 250M with 5 consecutive arch failures): val_bpb 0.896775->0.901883 WORSE by +0.005 despite final train loss 2.660 essentially tying baseline 2.658. MFU 73.5->70.4 and tok/s 40.7k->39.1k due to 4 sequential matmul rounds vs 1. Conclusion: hourglass benefit dilutes severely when restricted to 3/20 layers; or MLP-only layers (lacking attention input) don't benefit from compositional FFN depth like a whole-network test would. Train fit decent but does NOT transfer to BPB. Rules out partial hourglass FFN at MLP-only layers; any future hourglass attempt would need whole-network application (much higher implementation/throughput risk).
aa125ee	0.900152	9.3	70.4	40037	1526	250.3	4	2.656	discard	MoDA-lite depth K/V mix at L-attention layers: each L-layer at i in {7,11,15,19} additively mixes prior L-layer (l-4) cached pre-norm K/V into current k,v via learnable per-layer scalar depth_gate (init 0): k+=gate*prev_k; v+=gate*prev_v; cache stored post-RoPE post-key-shift pre-QKnorm; 17 new scalar params trained at scalar_lr*0.01 in own AdamW group; static fixed shape avoids c44037e all-prior compile/OOM (hypothesis: depth signal dilution at d20 limits info flow between far L-layers and gated K/V mixing fixes it per arxiv 2603.15619 MoDA; evidence: paper plus plateau plus c44037e ruling out only full-all-prior softmax form): val_bpb 0.896775->0.900152 WORSE by +0.0034 despite final train loss 2.656 tying baseline 2.658 and tok/s 40k stable. Recurring d20 failure mode: train-loss-tied-but-val-bpb-worse mirrors 1cf3600 580c70a 0c94b26 47acbbf. Conclusion: at d20 with QK-norm and partial RoPE, additive K/V residual from a prior L-layer overfits/regularizes harmfully; the model already has sufficient depth signal via residual stream and x0 broadcast. Rules out additive l-4 K/V mixing; future MoDA would need attention-side mixing (separate y_depth call) or different layer offsets, both higher cost.
7a7d189	0.901180	8.8	72.3	38964	1526	251.5	4	2.655	discard	GatedDeltaNet-lite swap in late S layers: replace short-window attention at layers 16 and 18 with diagonal GDN-style recurrent mixer (q/k/v SiLU projections, normalized q/k, alpha/beta gates, parallel cumulative delta scan, output gate) while preserving global L attention layers, RMSNorm/SwiGLU shell, VE injection, WSD, muP, and 200M token budget (hypothesis: OLMo Hybrid arxiv 2604.03444 and ICLR 2025 GDN suggest hybrid GDN+attention can improve sequence mixing without more global attention; evidence: FIFO idea gdn-slayer-swap-07 and no prior GDN/linear-attention attempts in results.tsv): val_bpb 0.896775->0.901180 WORSE by +0.0044 even though final train loss 2.655 slightly beat best 2.658 and MFU stayed healthy at 72.3. Conclusion: diagonal GDN-lite improves/maintains training fit but harms validation, likely because the simplified elementwise delta state lacks the QK attention geometry/positional selectivity provided by short-window attention; at d20 the S layers are still load-bearing. Rules out this cheap diagonal GDN substitution for late S layers; future GDN would need a faithful kernelized/chunk formulation or different placement, not this simplified scan.
98ed802	0.896994	9.5	75.1	43550	1526	250.3	4	2.654	discard	Environment upgrade: Windows deps moved to torch 2.12.0+cu130/torchao 0.17 and WSL Ubuntu 24.04 stack added CUDA toolkit 13.2 + PyTorch 2.12 cu130 + torchao 0.17 + Transformer Engine 2.15 with CUDA 13.2 cuBLAS preload (hypothesis: RTX 5070 Blackwell should benefit from newer cu13/FP8 stack; evidence: native torchao warned C++ extensions require torch>=2.11 and user requested DeepSeek/Blackwell FP8 frontier check): native Windows cu130 partial run was slower (~37.2k tok/s vs prior 40.7k), but WSL torchao standard FP8 full run reached 43.6k avg tok/s/75.1 MFU/9.5GB VRAM, a real +7% throughput gain over best KEEP 5b4910a. Validation worsened slightly 0.896775->0.896994 (+0.00022) despite final_loss 2.654 tying best 2.658; Transformer Engine regular FP8 smoke worked, but TE MXFP8 raised "not supported on 12.0+ architectures yet" and the old local _C_mxfp8.pyd is Windows/Python3.10/CUDA12-only. Conclusion: WSL cu13 standard FP8 is the fastest practical stack so far, but as an environment-only change it is not a BPB KEEP; rules out assuming newer/native/cu13 alone improves quality, and proves true MXFP8 still needs a different backend/build than current TE/torchao on RTX 5070 SM120.
9fb6906	0.901200	9.5	77.0	43557	1526	250.3	4	2.656	discard	DeepSeek-style explicit FP8 islands: convert only attention/MLP GEMM Linear modules c_q/c_k/c_v/c_proj/c_gate/c_up to torchao standard FP8 while protecting lm_head/logit path, ve_gate, embeddings, RMSNorm/norm ops, RoPE/QK attention math, loss, and optimizer states in BF16/FP32; audit printed 128 converted GEMM Linears and 18 protected Linears (17 ve_gate + lm_head). Hypothesis: 98ed802's faster-but-slightly-worse WSL FP8 run might recover BPB if high-precision islands were explicit, matching DeepSeek FP8 training practice. Evidence: 98ed802 showed WSL cu13 FP8 throughput gain but val_bpb 0.896994 vs best 0.896775. Result: val_bpb worsened badly to 0.901200 despite final_loss 2.656 near best and MFU improving to 77.0; throughput stayed high (~43.6k tok/s) but validation regressed by +0.0044. Conclusion: broad standard-FP8 conversion was not the sole quality issue; protecting lm_head/ve_gate explicitly does not stabilize this precision path, and the numeric/quantization noise in GEMM islands likely hurts generalization at 200M tokens. Rules out this DeepSeek-style island filter with torchao standard FP8 on RTX 5070; future precision work needs a fundamentally different true MXFP8/NVFP4 backend or should spend the WSL speedup without more precision partitioning.
